id,scrape_id,source,description,picture_url,host_url,host_since,host_about,host_response_rate,host_is_superhost,host_picture_url,host_listings_count,host_verifications,host_identity_verified,neighbourhood_cleansed,latitude,property_type,accommodates,bathrooms_text,beds,price,maximum_nights,maximum_minimum_nights,maximum_maximum_nights,maximum_nights_avg_ntm,has_availability,availability_60,availability_365,number_of_reviews,number_of_reviews_l30d,number_of_reviews_ly,estimated_revenue_l365d,last_review,review_scores_accuracy,review_scores_checkin,review_scores_location,license,calculated_host_listings_count,calculated_host_listings_count_private_rooms,reviews_per_month
50171851.0,20250600000000.0,previous scrape,"This completely modernized garden-level space provides a charming and unique atmosphere while also being centrally located in the Capital Region of New York. <br /><br />My partner and I have taken ample time to carefully craft this space to maximize its potential and ensure your enjoyment. Featuring a fully loaded kitchen with stainless steal appliances, marble countertops, exposed brick throughout, tasteful decor, and your own private patio. We truly hope you enjoy this space as much as we do!",https://a0.muscache.com/pictures/f0d70ecf-f5c0-47a9-869f-803dd89d9276.jpg,https://www.airbnb.com/users/show/48490017,2015-11-08,"I’ve been living in the NY Capital Region since 2016, and currently work full-time as a Sr. Performance Engineer in Renewable Energy (Onshore Wind). I’m also an avid athlete, and enjoy weightlifting as well as Brazilian Jiu-Jitsu. I also love food, art, fashion, design, and adventure - especially with my partner, Pan.",100%,t,https://a0.muscache.com/im/pictures/user/8cc2dec8-985f-4a48-a414-f00ba118b568.jpg?aki_policy=profile_x_medium,1,"['email', 'phone']",t,SIXTH WARD,42.65157,Entire rental unit,2,1 bath,,,365,2,365,365.0,t,16,100,190,2,38,,06/06/2025,4.99,4.97,4.89,,1,0,4.09
50207226.0,20250600000000.0,city scrape,"BEAUTIFULLY renovated and stylish apartment with CHARACTER in a historic building. 4K Smart TV with Netflix, and high speed internet ready for you to use! This property comes with a fully stocked kitchen, in unit washer/dryer, free resident lot parking, and a fenced shared backyard with bbq for guests to enjoy. <br /><br />This unit is located on floor 1 and is available for long term stays.",https://a0.muscache.com/pictures/hosting/Hosting-U3RheVN1cHBseUxpc3Rpbmc6NTAyMDcyMjY%3D/original/81cb373f-87f5-4fec-8f08-65ce2c9c8d69.jpeg,https://www.airbnb.com/users/show/47625981,2015-10-28,,100%,f,https://a0.muscache.com/im/pictures/user/fcdee17f-16de-4999-98d5-c28b545cc982.jpg?aki_policy=profile_x_medium,19,"['email', 'phone']",t,FOURTH WARD,42.65888,Entire rental unit,3,1 bath,1.0,$104.00,1125,2,1125,1125.0,t,50,196,89,3,12,9984.0,25/05/2025,4.83,4.89,4.47,,18,0,1.83
50211226.0,20250600000000.0,city scrape,"Private studio apartment with separate entrance on the garden level of owner-occupied home. Quiet and walkable area short distance from Empire Plaza, Capitol, Albany Med, Saint Rose, Center Square, and Downtown. Plenty of FREE on-street parking available. Self check in, so we don’t have to interact unless you want to. Let us know if you have any questions and look forward to hosting you!",https://a0.muscache.com/pictures/84c2822a-4803-4bc3-8f32-2021a326ee22.jpg,https://www.airbnb.com/users/show/105597161,2016-11-29,Welcome to Albany! I am a young professional from Upstate New York. I’ve put a lot of work into renovating my 100+ year old home and would love to host you!,100%,t,https://a0.muscache.com/im/pictures/user/User/original/5c1c8966-3222-4f83-b853-ea216dd3218c.jpeg?aki_policy=profile_x_medium,1,"['email', 'phone']",t,ELEVENTH WARD,42.66034,Entire rental unit,3,1 bath,2.0,$105.00,1125,2,1125,1125.0,t,11,11,185,4,37,15750.0,06/06/2025,4.97,4.99,4.8,,1,0,4.42
50354540.0,20250600000000.0,city scrape,"Immerse yourself in this meticulously updated 2-bedroom unit, where modern amenities and chic designer furnishings ensure a delightful stay. This elegant abode is mere steps from renowned restaurants, iconic landmarks, and vibrant nightlife. Enjoy the convenience of being centrally located in the capital region, with local hospitals just a stone's throw away. With its bright, clean, and professionally furnished interiors, this unit promises a welcoming retreat in the heart of the city",https://a0.muscache.com/pictures/da045b3b-b9c9-405f-94f3-06d112646e51.jpg,https://www.airbnb.com/users/show/188679144,2018-05-09,"I am a dedicated mother with a passion for health, wellness, gardening, cooking, travel, design, and aesthetics. As a detail-oriented native of the Capital District, I am committed to providing my guests with a delightful and memorable stay in Albany.",89%,t,https://a0.muscache.com/im/pictures/user/User-188679144/original/dbc89522-af0b-4a9f-b89a-43d27fd8d11c.jpeg?aki_policy=profile_x_medium,9,"['email', 'phone']",t,SIXTH WARD,42.65333,Entire rental unit,4,1 bath,2.0,$135.00,365,3,365,365.0,t,60,365,16,1,5,4860.0,05/06/2025,4.56,4.75,4.81,,8,0,0.33
50639032.0,20250600000000.0,previous scrape,"Relax in the garden, swing in the hammock and read, walk to a nearby bar, or travel 8 minutes and go dancing or listen to some of the Capital Region's exceptional music. This centrally located space has it all!  Walking distance to local bars and restaurants, and a 15 minute drive to trails and state parks. Backyard fire pit, large garden with sitting areas, fruit trees, herbs, hammocks, and spaces to unwind, you won't even know you are in the city!",https://a0.muscache.com/pictures/miso/Hosting-50639032/original/d1dcf067-aeb1-440e-a761-8459f62d6114.jpeg,https://www.airbnb.com/users/show/172539578,2018-02-09,"I love to make biodiverse gardens, paint, kayak, and read. spending time with my friends and family and helping others have safe places to explore and play are meaningful to me.",100%,t,https://a0.muscache.com/im/pictures/user/f4cbc7d3-a801-438c-9431-216bad89825b.jpg?aki_policy=profile_x_medium,4,"['email', 'phone']",t,FIFTEENTH WARD,42.67945,Private room in home,1,1 shared bath,,,1125,3,1125,1125.0,t,1,30,46,1,9,,17/05/2025,4.85,4.96,4.91,,4,3,1.02
50890336.0,20250600000000.0,city scrape,"This beautifully renovated and brightly decorated brownstone in historic Albany is your perfect getaway. Located just minutes from charming downtown, guests can enjoy all Albany has to offer. <br /><br />Very spacious bedroom and living area with an abundance of natural light creates a very comfortable environment! It features a fully stocked kitchen, in unit washer/dryer, free resident lot parking, and a fenced shared backyard with bbq for guests to enjoy.<br /><br />Long term stays available.",https://a0.muscache.com/pictures/6ec85269-a391-4169-9090-047fa6e1d932.jpg,https://www.airbnb.com/users/show/47625981,2015-10-28,,100%,f,https://a0.muscache.com/im/pictures/user/fcdee17f-16de-4999-98d5-c28b545cc982.jpg?aki_policy=profile_x_medium,19,"['email', 'phone']",t,FOURTH WARD,42.65901,Entire rental unit,2,1 bath,1.0,$108.00,1125,2,1125,1125.0,t,54,200,45,0,6,3240.0,25/07/2024,4.8,4.91,4.38,,18,0,0.96
51230498.0,20250600000000.0,city scrape,"Nestled in the heart of the city, our Airbnb exudes an enchanting charm with its stylish and romantic decor. Positioned on a vibrant city street, immerse yourself in the lively urban atmosphere. This energetic environment will carry some background noise. We prioritize your comfort and recommend bringing earplugs for light sleepers to ensure a restful stay.<br />Corner store -1 min<br />Airport, bus & train station -15 min.<br />Outdoor cameras<br />$250 indoor smoking violation fee<br />$250 pet cleaning fee, no pets",https://a0.muscache.com/pictures/miso/Hosting-51230498/original/6151a826-8303-4f7b-a28a-8f73c067d259.jpeg,https://www.airbnb.com/users/show/414738935,2021-07-23,,100%,f,https://a0.muscache.com/im/pictures/user/2262026a-baa4-4176-9fab-9f287e537339.jpg?aki_policy=profile_x_medium,1,"['email', 'phone']",t,THIRD WARD,42.66064,Room in aparthotel,2,1 bath,1.0,$65.00,1125,2,1125,1125.0,t,36,217,255,0,39,13650.0,16/04/2025,4.84,4.81,4.22,,1,0,5.4
51461480.0,20250600000000.0,city scrape,"Charming private 1 bed, 1 bath garden suite just steps away from historic Washington Park.  <br /><br />Walking distance from Albany Med. and downtown SUNY.  A stylish brownstone with culturally diverse art & experiences & full amenities.  <br /><br />Near iconic places like the NYS Capital, Empire State Plaza, Egg Performing Arts Ctr., restaurants, and more. <br /><br />The unit is perfect for mature business & medical travelers, and couples looking for a home away from home to unwind and relax while visiting the Capital.",https://a0.muscache.com/pictures/hosting/Hosting-51461480/original/f41db419-7481-4336-aaf3-e09a0033f4d8.jpeg,https://www.airbnb.com/users/show/416799784,2021-08-04,"Our team works hard to ensure guests feel welcome while honoring their privacy at a fair rate.  Thank you for looking us up~we hope to see you soon! 

Please note, that there is some minor construction happening nearby as reflected in the nightly rate. ",100%,t,https://a0.muscache.com/im/pictures/user/b84fe6c8-e1c6-4a9a-acdd-e3e57e8a8391.jpg?aki_policy=profile_x_medium,1,"['email', 'phone']",t,TENTH WARD,42.65969,Entire rental unit,2,1 bath,1.0,$89.00,1125,7,1125,1125.0,t,18,113,28,0,4,8722.0,21/04/2025,4.96,5.0,4.96,,1,0,0.63
51503537.0,20250600000000.0,city scrape,"This modern, luxurious,  and spacious one bedroom with lofted den will exceed all expectations! Located in a mixed use building with a Pizza Shop on the ground floor, other businesses and apartments on the floors above; you will have it all at your fingertips. Staying here will give you the opportunity to be walking distance to anything you may need in downtown Albany! Try out our rooftop seating area, fitness center, and theatre room in your down time. Extended stays welcome!@allseasonsgetaway_",https://a0.muscache.com/pictures/6923f845-7bef-440d-9774-15dbf62d8d94.jpg,https://www.airbnb.com/users/show/394420519,2021-03-27,,100%,f,https://a0.muscache.com/im/pictures/user/07714e7d-1705-4696-b180-2aa9cdb56761.jpg?aki_policy=profile_x_medium,9,"['email', 'phone']",t,THIRD WARD,42.65061,Entire rental unit,2,1 bath,1.0,$138.00,365,4,1125,1125.0,t,53,262,9,0,2,1104.0,09/09/2024,4.56,3.67,4.56,,1,0,0.2
51579900.0,20250600000000.0,city scrape,"This beautifully renovated and brightly decorated brownstone in historic Albany is your perfect getaway. Located just minutes from charming downtown, guests can enjoy all Albany has to offer. <br /><br />This spacious bedroom and living area has an abundance of natural light creates a very comfortable environment! This property comes with a fully stocked kitchen, in unit washer/dryer, free resident lot parking, and a fenced shared backyard with bbq for guests to enjoy.<br /><br />Long term stays available.",https://a0.muscache.com/pictures/8348d42d-71ae-457e-8428-61d78b10d1df.jpg,https://www.airbnb.com/users/show/47625981,2015-10-28,,100%,f,https://a0.muscache.com/im/pictures/user/fcdee17f-16de-4999-98d5-c28b545cc982.jpg?aki_policy=profile_x_medium,19,"['email', 'phone']",t,FOURTH WARD,42.65856,Entire rental unit,3,1 bath,1.0,$99.00,1125,2,1125,1125.0,t,48,194,78,2,11,5940.0,25/05/2025,4.85,4.81,4.56,,18,0,1.68
51592836.0,20250600000000.0,city scrape,"Relax in a newly renovated one bedroom/one bathroom apartment located on the first floor of a charming brownstone building. It features lofty ceilings with beautiful architecture and a newly remodeled kitchen. Conveniently located to the Palace Theater, Capitol Rep Theater, Times Union Center and the Empire State Plaza. This rental is in walking distance to many popular eateries, bars, and more to explore!",https://a0.muscache.com/pictures/miso/Hosting-51592836/original/df72eb98-27e3-4f7f-a23a-0df3e76240a9.jpeg,https://www.airbnb.com/users/show/60293220,2016-02-24,,100%,t,https://a0.muscache.com/im/pictures/user/7565f399-7df6-4497-8893-9c41faac79ea.jpg?aki_policy=profile_x_medium,3,"['email', 'phone', 'work_email']",t,THIRD WARD,42.65844,Entire rental unit,2,1 bath,1.0,$89.00,365,3,365,365.0,t,33,337,90,1,19,6942.0,26/05/2025,4.89,4.93,4.48,,3,0,2.02
51710034.0,20250600000000.0,previous scrape,"Listing is designed with the business or casual traveler in mind PLEASE NO SMOKERS in the building *Newly renovated *Modern 1 bedroom w/Smart TVs that feels like home *Street parking *Equipped with coffee maker *Fridge *Wireless charger *Private bath *Across the street from the Capitol Building *Close to Highway I-87, I-90, I-787 & public transportation. Long term stays available. Please inquire with dates needed for more info. Traveling nurses, doctors, lobbyists, students are welcome.",https://a0.muscache.com/pictures/miso/Hosting-51710034/original/fad88eee-b997-42e9-991c-6dce3479cc0e.png,https://www.airbnb.com/users/show/392074908,2021-03-11,,100%,f,https://a0.muscache.com/im/pictures/user/887ef5ba-730a-4e57-a743-10642ec14bcd.jpg?aki_policy=profile_x_medium,3,"['email', 'phone']",t,SIXTH WARD,42.65269,Entire condo,2,1 bath,,,365,2,1125,1125.0,t,29,334,43,1,6,,14/05/2025,4.65,4.79,4.81,,3,0,0.93
51954621.0,20250600000000.0,city scrape,"Relax in the garden, swing in the hammock and read, walk to a nearby bar, or travel 8 minutes and go dancing or listen to some of the Capital Region's exceptional music. This centrally located space has it all! Walking distance to local bars and restaurants, and a 15 minute drive to trails and state parks. Backyard fire pit, large garden with sitting areas, fruit trees, herbs, hammocks, and spaces to unwind, you won't even know you are in the city!",https://a0.muscache.com/pictures/miso/Hosting-50639032/original/2a96ed3a-0376-487f-a9b3-7efb9a5093b9.jpeg,https://www.airbnb.com/users/show/172539578,2018-02-09,"I love to make biodiverse gardens, paint, kayak, and read. spending time with my friends and family and helping others have safe places to explore and play are meaningful to me.",100%,t,https://a0.muscache.com/im/pictures/user/f4cbc7d3-a801-438c-9431-216bad89825b.jpg?aki_policy=profile_x_medium,4,"['email', 'phone']",t,FIFTEENTH WARD,42.67812,Private room in home,1,1 private bath,1.0,$45.00,180,3,1125,1125.0,t,25,220,11,0,0,270.0,04/03/2025,5.0,5.0,5.0,,4,3,0.25
52152157.0,20250600000000.0,city scrape,,https://a0.muscache.com/pictures/80c3bf83-dfeb-44a0-bda7-bae53932520b.jpg,https://www.airbnb.com/users/show/152762198,2017-09-30,"Hi my name is Allen. I am an Albany native. I enjoy working out, playing basketball and have a passion for good food. I hope anyone staying here will enjoy the space as much as I do. ",100%,t,https://a0.muscache.com/im/pictures/user/4b2545af-2a93-4e42-84e9-e95579a9d9c2.jpg?aki_policy=profile_x_medium,9,"['email', 'phone']",t,FIRST WARD,42.63066,Entire townhouse,5,1 bath,2.0,$96.00,365,3,365,365.0,t,26,145,72,3,19,9792.0,01/06/2025,4.92,4.93,4.72,,9,0,1.6
52241973.0,20250600000000.0,city scrape,"Welcome to our charming studio in the heart of Albany's Center Square. Nestled in one of the oldest homes in the neighborhood, the space has been restored to blend history with modern convenience. Recently renovated, it features a modern bathroom with rain shower. The décor is a nod to mid-century aesthetics.  This cozy studio is a stone's throw away from Albany's main attractions within easy walking distance. Experience a unique blend of past and present in this delightful Albany retreat.",https://a0.muscache.com/pictures/hosting/Hosting-U3RheVN1cHBseUxpc3Rpbmc6NTIyNDE5NzM%3D/original/847cb5d5-bb01-44a4-91ed-b686379f30b9.jpeg,https://www.airbnb.com/users/show/35465673,2015-06-10,,100%,t,https://a0.muscache.com/im/pictures/user/2f02dad4-c34b-40c0-98a9-314cf2562f72.jpg?aki_policy=profile_x_medium,1,"['email', 'phone']",t,SIXTH WARD,42.65641,Entire guest suite,2,1 bath,1.0,$75.00,27,1,1125,1125.0,t,32,61,320,8,97,19125.0,22/05/2025,4.93,4.9,4.87,,1,0,7.21
52611613.0,20250600000000.0,city scrape,,https://a0.muscache.com/pictures/5232bdb8-fe7e-4ae9-8e9f-0937ac4247f1.jpg,https://www.airbnb.com/users/show/232967878,2018-12-28,,99%,t,https://a0.muscache.com/im/pictures/user/User-232967878/original/cea8ebfc-ac7a-4317-a182-2fe36680942c.jpeg?aki_policy=profile_x_medium,24,['phone'],t,NINTH WARD,42.65674,Entire home,6,1 bath,3.0,$149.00,1125,2,1125,1125.0,t,39,224,135,2,30,22350.0,17/05/2025,4.9,4.98,4.92,,22,0,3.04
52619545.0,20250600000000.0,city scrape,* Centrally located Eclectic vibe 2 bed w/parking,https://a0.muscache.com/pictures/b4b0d866-5a55-45c2-89e7-725b0ef34e8c.jpg,https://www.airbnb.com/users/show/232967878,2018-12-28,,99%,t,https://a0.muscache.com/im/pictures/user/User-232967878/original/cea8ebfc-ac7a-4317-a182-2fe36680942c.jpeg?aki_policy=profile_x_medium,24,['phone'],t,THIRTEENTH WARD,42.67102,Entire rental unit,4,1 bath,2.0,$106.00,1125,2,1125,1125.0,t,25,25,89,1,15,10812.0,17/05/2025,4.84,4.89,4.81,,22,0,1.99
52691284.0,20250600000000.0,city scrape,,https://a0.muscache.com/pictures/b8766e9e-aa08-4fc5-8677-f5aec9de23c8.jpg,https://www.airbnb.com/users/show/232967878,2018-12-28,,99%,t,https://a0.muscache.com/im/pictures/user/User-232967878/original/cea8ebfc-ac7a-4317-a182-2fe36680942c.jpeg?aki_policy=profile_x_medium,24,['phone'],t,TENTH WARD,42.66236,Entire home,12,2.5 baths,7.0,$476.00,365,2,1125,1125.0,t,37,240,90,1,26,62832.0,11/05/2025,4.97,4.98,4.93,,22,0,2.03
52836323.0,20250600000000.0,city scrape,"Cozy first floor 2-Bedroom located in a Pre-war building. Unit offers hardwood floors, well equipped bedrooms, bathrooms and kitchen.  Only a 10 min walk to fabulous cafe and restaurants on Madison Avenue.  Everything you've been looking forward right at your finger tips. <br /><br />>Nearby<br />○ 3 Min to Saint Rose <br />○ 4 min to St Peters<br />○ 7 min to Albany MED<br />○ 5 Min to Lark Street<br />○ 7 Min to Downtown<br />○ 7 Min to SUNY Albany<br />○ 8 Min to Palace Theater",https://a0.muscache.com/pictures/32dc7892-0eee-4643-805e-36962a45f37f.jpg,https://www.airbnb.com/users/show/232967878,2018-12-28,,99%,t,https://a0.muscache.com/im/pictures/user/User-232967878/original/cea8ebfc-ac7a-4317-a182-2fe36680942c.jpeg?aki_policy=profile_x_medium,24,['phone'],t,THIRTEENTH WARD,42.67242,Entire rental unit,4,1 bath,2.0,$120.00,365,1,365,365.0,t,1,1,85,0,30,10080.0,16/11/2024,4.89,4.95,4.84,,22,0,2.02
52837196.0,20250600000000.0,city scrape,"BEAUTIFULLY renovated apartment with CHARACTER in a historic building. This is a ground floor unit with direct fenced backyard access and a private patio! Ideal for pet owners! 4K Smart TV with Netflix, and high speed internet ready for you to use! This property comes with a fully stocked kitchen, in unit washer/dryer, free resident lot parking, and a fenced shared backyard with bbq for guests to enjoy.",https://a0.muscache.com/pictures/miso/Hosting-52837196/original/bb1d1ebc-6e8c-470f-9f3e-62f76d279b61.png,https://www.airbnb.com/users/show/47625981,2015-10-28,,100%,f,https://a0.muscache.com/im/pictures/user/fcdee17f-16de-4999-98d5-c28b545cc982.jpg?aki_policy=profile_x_medium,19,"['email', 'phone']",t,FOURTH WARD,42.65812,Entire rental unit,3,1 bath,1.0,$104.00,1125,2,1125,1125.0,t,50,196,76,3,15,7488.0,26/05/2025,4.74,4.76,4.51,,18,0,1.72
52863776.0,20250600000000.0,city scrape,"This 2nd floor one bedroom in a Historic Brownstone 1800's across the street from Washington park. Beautiful woodwork throughout with all the comforts of home. Great area where you can walk or jog in the park or just enjoy a cup of coffee outside. Choice of restaurants, stores & shops on Lark street. Movie theater, hospitals and malls all in close proximity. We are located on State street in Albany in a desirable residential area with easy Uber or Lyft service available.  ((NO PARTIES!!))",https://a0.muscache.com/pictures/cc451322-9571-4b88-b027-36020b57e208.jpg,https://www.airbnb.com/users/show/355777684,2020-07-11,"Hello my name is Lloyd and I'm currently a Superhost on my personal listings for over 5 years. These listings I'm co-hosting with a family friend and hopefully you will get to enjoy some of our amazing spaces. We take pride in providing a great, clean space for your stay! We love questions so please ask us anything you'd like. Thank You for stopping by and safe traveling!",100%,t,https://a0.muscache.com/im/pictures/user/044afeb0-994b-4ca3-b6ee-6e0e9ad61f8f.jpg?aki_policy=profile_x_medium,3,"['email', 'phone']",t,SIXTH WARD,42.65826,Entire rental unit,4,1 bath,2.0,$105.00,1125,1,1125,1125.0,t,13,289,205,3,48,25830.0,18/05/2025,4.97,4.99,4.97,,3,0,4.66
52923647.0,20250600000000.0,city scrape,You'll have a great time at this comfortable place to stay.,https://a0.muscache.com/pictures/4a3294f3-41b0-437b-b590-77fa18836df4.jpg,https://www.airbnb.com/users/show/428451585,2021-10-21,,0%,f,https://a0.muscache.com/im/pictures/user/9674fd32-71ab-42c9-b7af-76025943fe18.jpg?aki_policy=profile_x_medium,1,"['email', 'phone']",t,EIGHTH WARD,42.64792,Entire vacation home,4,2 baths,2.0,$257.00,365,3,365,365.0,t,60,364,0,0,0,0.0,,,,,,1,0,
53312101.0,20250600000000.0,city scrape,1 bedroom with high ceiling and natural light. Fully stocked kitchen with complimentary Netflix. Centrally located in South End of Albany in converted school. Great value with off street parking included,https://a0.muscache.com/pictures/8d8fa171-8c8b-430a-aa50-e7614767e018.jpg,https://www.airbnb.com/users/show/232967878,2018-12-28,,99%,t,https://a0.muscache.com/im/pictures/user/User-232967878/original/cea8ebfc-ac7a-4317-a182-2fe36680942c.jpeg?aki_policy=profile_x_medium,24,['phone'],t,SECOND WARD,42.64369,Entire rental unit,2,1 bath,2.0,$78.00,730,2,730,730.0,t,21,21,62,1,17,6084.0,17/05/2025,4.84,4.84,4.37,,22,0,1.43
53483727.0,20250600000000.0,city scrape,"Visiting Albany for work, vacation, or to visit family? The Twitchell Estate is a spacious 4BR home that will be perfect for your stay. This elegantly designed Boho Chic rental comes with amenities such as self-check-in, Netflix, Disney+, Apple TV, and many other streaming options if you're looking to relax indoors, and a private laptop-friendly office with Wi-Fi if you need to get work done. Enjoy free coffee and tea in the stocked kitchen, with everything you need to feel like you are at home.",https://a0.muscache.com/pictures/miso/Hosting-53483727/original/640fe42e-feb6-4a37-bab7-f4ab9d853085.jpeg,https://www.airbnb.com/users/show/433096110,2021-11-22,,100%,t,https://a0.muscache.com/im/pictures/user/30c0b064-316a-436f-8b55-6ed68fc044fd.jpg?aki_policy=profile_x_medium,4,"['email', 'phone']",t,FOURTEENTH WARD,42.65824,Entire vacation home,8,1.5 baths,4.0,$205.00,28,1,28,28.0,t,40,249,158,0,53,43050.0,16/04/2025,4.97,4.96,4.83,,3,0,3.78
53567589.0,20250600000000.0,city scrape,"Discover Lark Street - A Hip Albany Neighborhood. With countless restaurants, cafes, art galleries, special events, and more, this funky arts and entertainment district is a major Albany hotspot. The Spot on Lark is a beautifully renovated 1850s era 4 - story brick building, in the heart of Lark Street, and a perfect oasis to relax and explore. We have taken ample time to carefully craft this space with tasteful décor, to maximize its potential and ensure your enjoyment",https://a0.muscache.com/pictures/2e5b6926-a177-4bb6-b01f-9d085e3bbfdf.jpg,https://www.airbnb.com/users/show/433096110,2021-11-22,,100%,t,https://a0.muscache.com/im/pictures/user/30c0b064-316a-436f-8b55-6ed68fc044fd.jpg?aki_policy=profile_x_medium,4,"['email', 'phone']",t,SIXTH WARD,42.65204,Entire rental unit,2,1 bath,1.0,$98.00,28,1,28,28.0,t,40,339,269,7,71,24990.0,06/06/2025,4.91,4.96,4.78,,3,0,6.33
53645427.0,20250600000000.0,city scrape,"BEAUTIFUL + LUXURIOUS renovated apartment with CHARACTER in a historic building. <br /><br />This spacious 2 bedroom feature a bright reading nook in the master bedroom, an office space, a soaker tub, 4K Smart TV with Netflix, and high speed internet ready for you to use! It comes with a fully stocked kitchen, in unit washer/dryer, free resident parking, and a fenced shared backyard with bbq for guests to enjoy.",https://a0.muscache.com/pictures/bdf2a8b8-187d-42b2-8172-f7716e0324fb.jpg,https://www.airbnb.com/users/show/47625981,2015-10-28,,100%,f,https://a0.muscache.com/im/pictures/user/fcdee17f-16de-4999-98d5-c28b545cc982.jpg?aki_policy=profile_x_medium,19,"['email', 'phone']",t,FOURTH WARD,42.65913,Entire rental unit,5,2 baths,2.0,$135.00,1125,2,1125,1125.0,t,32,175,119,2,36,23490.0,25/05/2025,4.78,4.73,4.39,,18,0,2.8
53860077.0,20250600000000.0,city scrape,"Meticulously and lovingly maintained home. Living and dining rooms feature gleaming hardwood floors.   Private fenced in yard. Excellent Albany location off of Western Ave- close to highways, restaurants, shopping etc.  New sauna space sauna with 8 bulbs built, next to a full bath with heated floor and small weight set, bench and treadmill.",https://a0.muscache.com/pictures/1cafb81b-fb57-4d65-aacc-a87b963faec3.jpg,https://www.airbnb.com/users/show/4259750,2012-11-27,"I was born in Poland but grew up in NY and now i'm back in NY after grad school in Europe.  I love sailing, flying gliders, hiking, hammocks, cycling, photography, travel, minimalism, tennis,  podcasts, biohacking and my KJV.  I started traveling airbnb during my time in Europe and now I’m a host in NY! 
Listings:
airbnb.com/h/38eden
airbnb.com/h/55eden
airbnb.com/h/18home
airbnb.com/h/24miller
airbnb.com/h/24eden
airbnb.com/h/433western",100%,t,https://a0.muscache.com/im/pictures/user/cca29440-809e-4dcd-a844-221898102fa5.jpg?aki_policy=profile_x_medium,8,"['email', 'phone']",t,FIFTEENTH WARD,42.674675,Entire cottage,8,2 baths,4.0,$343.00,1125,2,1125,1125.0,t,30,335,40,0,19,39102.0,14/04/2025,4.98,5.0,4.98,,8,0,1.02
