id,scrape_id,source,description,picture_url,host_url,host_since,host_about,host_response_rate,host_is_superhost,host_picture_url,host_listings_count,host_verifications,host_identity_verified,neighbourhood_cleansed,latitude,property_type,accommodates,bathrooms_text,beds,price,maximum_nights,maximum_minimum_nights,maximum_maximum_nights,maximum_nights_avg_ntm,has_availability,availability_60,availability_365,number_of_reviews,number_of_reviews_l30d,number_of_reviews_ly,estimated_revenue_l365d,last_review,review_scores_accuracy,review_scores_checkin,review_scores_location,license,calculated_host_listings_count,calculated_host_listings_count_private_rooms,reviews_per_month
1.19646e+18,20250600000000.0,city scrape,"Experience the best of Albany from the comfort of this centrally located, 1-bed, 1-bath vacation rental. This property features a cozy living area with a Smart TV, free WiFi, a full kitchen, views of New York's State Capitol, and access to the area's top attractions. Enjoy a peaceful morning stroll through Washington Park, tour museums and sights in the area, and shop and dine at nearby eateries and bars. Whether you're in town for work or play, this convenient condo offers a memorable stay!",https://a0.muscache.com/pictures/prohost-api/Hosting-1196459023545165129/original/d965289b-61da-4736-b5da-c42089b0057c.jpeg,https://www.airbnb.com/users/show/121680792,2017-03-20,"Hi! We’re Evolve, the hospitality team that helps you rest easy when you rent a private, professionally cleaned home from us.

We promise your rental will be clean, safe, and true to what you saw on Airbnb or we'll make it right. Check-ins are always smooth, and we're here 24/7 to answer any questions or help you find the perfect property.",100%,f,https://a0.muscache.com/im/pictures/user/User-121680792/original/62151d0c-7ad7-4639-bc42-20b0320d302e.png?aki_policy=profile_x_medium,1237,"['email', 'phone']",t,SIXTH WARD,42.655732,Entire condo,2,1 bath,1.0,$280.00,1125,5,1125,1125.0,t,5,309,0,0,0,0.0,,,,,,5,0,
1.19859e+18,20250600000000.0,city scrape,"Introducing *The LEO Home*, a newly renovated four-bedroom apartment nestled conveniently in the heart of Albany. The apartment boasts a shared living room, bathroom, and kitchen, providing a cozy and inviting atmosphere. Located just one mile from Albany Med and other nearby local hospitals. This shared accommodation is ideal for medical and traveling professionals. Each bedroom accommodates one traveler. Blackout curtains create a restful environment for those working night or swing shifts.",https://a0.muscache.com/pictures/miso/Hosting-902326803627859755/original/3870877c-f0df-4b2c-916b-6068da4b5314.jpeg,https://www.airbnb.com/users/show/349460842,2020-06-10,Hi my name is Scott Guadagnino. I’ve been in the Albany area for 9 years. Went to school in South Carolina. We love hosting and having guests at our 4 Airbnb’s!,100%,t,https://a0.muscache.com/im/pictures/user/User-349460842/original/b19931f2-cd8b-4aec-96be-ecf0a6a0161d.jpeg?aki_policy=profile_x_medium,17,"['email', 'phone']",t,TENTH WARD,42.66269,Private room in home,1,1 shared bath,1.0,$56.00,365,30,365,365.0,t,0,65,0,0,0,0.0,,,,,,17,13,
1.2087e+18,20250600000000.0,city scrape,"Charming first-floor apartment with five cozy bedrooms & 1.5 modern bathrooms. Your private bedroom has a full-size bed, dresser, ample closet space, blackout curtains & Smart TV. Custom stone fireplace in the living room, original hardwood floors, washer & dryer. Fully equipped kitchen w/ quartz countertops & stainless steel appliances, generous-sized dining room table, free street parking, and weekly cleaning of common areas. Prime location with easy access to local food spots and hospitals.",https://a0.muscache.com/pictures/miso/Hosting-1158059552251999833/original/7b3e628d-eab2-4de5-ad1c-49658e8fa898.jpeg,https://www.airbnb.com/users/show/349460842,2020-06-10,Hi my name is Scott Guadagnino. I’ve been in the Albany area for 9 years. Went to school in South Carolina. We love hosting and having guests at our 4 Airbnb’s!,100%,t,https://a0.muscache.com/im/pictures/user/User-349460842/original/b19931f2-cd8b-4aec-96be-ecf0a6a0161d.jpeg?aki_policy=profile_x_medium,17,"['email', 'phone']",t,TENTH WARD,42.6639,Private room in home,1,1.5 shared baths,1.0,$56.00,365,28,365,365.0,t,38,342,0,0,0,0.0,,,,,,17,13,
1.20931e+18,20250600000000.0,city scrape,"Hello, thanks for checking out my listing! <br />This vintage, updated home has  multiple living areas inc. living room, dining room, enclosed porch & outdoor patio with tree-lined back yard. large bedroom, shared 1.5 baths. <br /><br />2 mi to Albany Medical, the VA, 1 mi to St Peter's. Approx. 1 mi (walkable!) from University at Albany main campus, Harriman State campus, groceries & nightlife.<br /><br />Please note that the mattress is a short queen.<br />A very affectionate, senior cat lives here!",https://a0.muscache.com/pictures/hosting/Hosting-1209313814437527365/original/db89bc7c-faeb-4f10-a523-cee64ef4916f.jpeg,https://www.airbnb.com/users/show/20536619,2014-08-25,I love hosting international students and professionals relocating to the area because I get to help introduce them to our amazing city!,100%,t,https://a0.muscache.com/im/pictures/user/User-20536619/original/88f3c273-d81d-43f3-8b54-9a5fce9da246.jpeg?aki_policy=profile_x_medium,8,"['email', 'phone']",t,THIRTEENTH WARD,42.67318,Private room in home,2,1.5 shared baths,1.0,$68.00,89,7,89,89.0,t,59,88,2,0,2,1904.0,27/10/2024,5.0,5.0,5.0,,8,7,0.25
1.21088e+18,20250600000000.0,city scrape,"3 bedroom/ designated office space, fast WiFi  fully furnished professionally decorated  with high end mattress and gourmet kitchen. Washer and dryer w supplies. Complimentary parking. Garden like grounds w full gym. <br />Peaceful neighborhood close to everything.",https://a0.muscache.com/pictures/hosting/Hosting-1210875317904799284/original/564c7cd7-b4ea-4d3a-a637-2bff6129667d.jpeg,https://www.airbnb.com/users/show/147780154,2017-08-26,"Close to all events, hospitals, hiking, Saratoga, Hudson Valley",,f,https://a0.muscache.com/im/pictures/user/User/original/2c4695aa-2c66-482f-ae33-ec26d9314621.jpeg?aki_policy=profile_x_medium,1,"['email', 'phone']",t,EIGHTH WARD,42.65812,Entire home,4,1.5 baths,2.0,$199.00,90,3,90,90.0,,54,358,0,0,0,0.0,,,,,,1,0,
1.22385e+18,20250600000000.0,city scrape,Forget your worries in this spacious and serene space.,https://a0.muscache.com/pictures/miso/Hosting-1223845635352908531/original/81274bd4-2489-483c-9056-c037bafece50.jpeg,https://www.airbnb.com/users/show/575030103,2024-04-30,,100%,t,https://a0.muscache.com/im/pictures/user/f03487f4-d810-4572-a25b-5254cfa2582a.jpg?aki_policy=profile_x_medium,2,"['email', 'phone', 'work_email']",t,ELEVENTH WARD,42.6633254,Entire rental unit,4,1 bath,3.0,$108.00,365,3,365,365.0,t,45,349,10,2,5,6480.0,01/06/2025,4.4,4.4,4.0,,2,1,1.26
1.22418e+18,20250600000000.0,city scrape,"Forget your worries in this spacious and serene space.this place is near hospitals, colleges, restaurants and many more. Peaceful, quiet area.  You will have a living and dining room, a spacious kitchen and bathroom. It’s a shared place.",https://a0.muscache.com/pictures/hosting/Hosting-1135812630237897119/original/5d563a38-ffb5-4d02-85f9-e29407a7a91d.jpeg,https://www.airbnb.com/users/show/522436003,2023-06-27,,100%,t,https://a0.muscache.com/defaults/user_pic-225x225.png?v=3,3,['phone'],t,THIRTEENTH WARD,42.66859,Private room in rental unit,1,1 shared bath,1.0,$55.00,365,28,365,365.0,t,0,295,2,0,1,6160.0,01/04/2025,5.0,5.0,4.5,,3,3,0.24
1.22749e+18,20250600000000.0,city scrape,Three bedroom upstairs apartment in a 2 family home. Recently updated kitchen and fully renovated bath.,https://a0.muscache.com/pictures/hosting/Hosting-1227494196390230149/original/9faed29b-e3dc-4da2-82ac-1576168b5d7e.jpeg,https://www.airbnb.com/users/show/52123673,2015-12-23,,100%,,https://a0.muscache.com/im/pictures/user/65593fa6-0f74-4f1d-a5e3-16a443b1ca1c.jpg?aki_policy=profile_x_medium,3,"['email', 'phone']",t,THIRTEENTH WARD,42.66955,Entire rental unit,5,1 bath,3.0,$158.00,300,3,300,300.0,t,41,345,7,1,4,6636.0,16/05/2025,5.0,5.0,4.86,,1,0,0.77
1.2293e+18,20250600000000.0,city scrape,Make some memories at this unique and family-friendly place. super calm and spacious two story apartment on the second floor. this unit gives a treehouse vibe where there's a full atic on the top floor and a small door/hatch to access the rear patio. small area on the patio have s drink read a book or just to enjoy a evening breeze outside 🙂.,https://a0.muscache.com/pictures/hosting/Hosting-1229302903741056027/original/7f6b8125-0521-4652-91d5-70502ef2cb1f.jpeg,https://www.airbnb.com/users/show/562084689,2024-02-14,,100%,f,https://a0.muscache.com/im/pictures/user/User/original/efef71b7-d4f8-481f-920c-cb7db6159e40.jpeg?aki_policy=profile_x_medium,4,['phone'],t,TENTH WARD,42.66104,Entire rental unit,6,1 bath,4.0,$150.00,365,1,1125,1125.0,t,0,159,14,1,8,12600.0,10/05/2025,4.5,4.57,4.14,,2,0,1.47
1.22934e+18,20250600000000.0,city scrape,"Enjoy a stylish experience at this centrally-located place. Its in the heart of College town area, a busy area when shxools in season. There are bus lines, restaurants and bars. About 1-2 miles in between three colleges, Albany medical and Saint Peters hospitals, the state buildings and Washington park.",https://a0.muscache.com/pictures/hosting/Hosting-1229336497403850446/original/cf99d19f-0d82-4b29-8e01-cecbdc3d691a.jpeg,https://www.airbnb.com/users/show/562084689,2024-02-14,,100%,f,https://a0.muscache.com/im/pictures/user/User/original/efef71b7-d4f8-481f-920c-cb7db6159e40.jpeg?aki_policy=profile_x_medium,4,['phone'],t,ELEVENTH WARD,42.66319,Entire rental unit,7,1 bath,3.0,$145.00,365,1,1125,1125.0,t,37,340,33,2,15,28710.0,25/05/2025,4.63,4.69,4.59,,2,0,3.59
1.23026e+18,20250600000000.0,city scrape,"Welcome to The Urban Nest! Our updated 1BR garden apartment in Albany’s Center Square is centrally located near restaurants, shops, and nightlife. A short walk to Washington Park, Empire State Plaza, NYS Capitol, MVP Arena, The Palace Theater, and The Egg. Enjoy a comfortable king bed, in-unit laundry, a fully equipped kitchen, a dedicated workspace, Smart TV, fast WiFi, and free on-street parking. We're here to ensure your stay is perfect!",https://a0.muscache.com/pictures/hosting/Hosting-1230257693323535013/original/d90ff639-258b-4645-94c4-2a122a2cb38d.jpeg,https://www.airbnb.com/users/show/106636448,2016-12-08,,100%,t,https://a0.muscache.com/im/pictures/user/881eee58-be88-4180-9bcb-23691c7a7a59.jpg?aki_policy=profile_x_medium,1,"['email', 'phone']",t,SIXTH WARD,42.65507161,Entire rental unit,3,1 bath,2.0,$115.00,28,3,28,28.0,t,34,243,43,4,9,29325.0,21/05/2025,4.91,4.91,4.84,,1,0,7.09
1.23337e+18,20250600000000.0,city scrape,"Larson Gold sits in Albany's vibrant Center Square district, offering easy access to dining, shopping, and entertainment. With excellent public transportation and nearby highways, convenience is at your doorstep. Experience the city's rich cultural scene, diverse dining options, and lively nightlife, all within walking distance. Don't miss out on this perfect blend of historic charm and modern amenities.",https://a0.muscache.com/pictures/miso/Hosting-1233366548908684664/original/003af435-c0ce-476b-9d65-ba2f206f095a.jpeg,https://www.airbnb.com/users/show/233515764,2018-12-31,Hi. This is Etem. I am also host and trying to enjoy my life.,100%,f,https://a0.muscache.com/im/pictures/user/167502b9-a36b-4beb-81f5-2b09a23822e9.jpg?aki_policy=profile_x_medium,6,"['email', 'phone']",t,SIXTH WARD,42.65173,Entire rental unit,4,1 bath,3.0,$74.00,365,1,365,365.0,t,14,199,55,7,27,18870.0,01/06/2025,4.84,4.89,4.47,,6,0,6.02
1.23438e+18,20250600000000.0,city scrape,"Nestled in the vibrant heart of the historic Center Square downtown area, this tranquil one-bedroom garden apartment offers a serene escape from the bustling city life. Housed within a charming brownstone building, it boasts a fully furnished living room that invites relaxation, a spacious bathroom for your comfort, and a convenient laundry room. This gem combines the allure of history with modern living. Near Hospitals, Schools and Government buildings.",https://a0.muscache.com/pictures/miso/Hosting-1234376912864523021/original/f3d6e498-5c3f-438b-b3a9-230a466e0617.jpeg,https://www.airbnb.com/users/show/564967431,2024-03-02,,100%,f,https://a0.muscache.com/im/pictures/user/User/original/1d8cd42a-d142-4770-953c-7bbf1d5e4a36.jpeg?aki_policy=profile_x_medium,2,"['email', 'phone']",t,SIXTH WARD,42.65046807,Entire rental unit,2,1 bath,1.0,$82.00,365,4,365,365.0,t,9,313,2,0,2,984.0,28/10/2024,5.0,5.0,5.0,,2,0,0.26
1.23796e+18,20250600000000.0,city scrape,"This comfortable one bedroom apartment comes furnished to entertain and with a welcome drink! Stay in the capital region’s most historic neighborhood full of beautiful architecture and cultural attractions. Walkable to some of Albany’s best restaurants including Dove and Deer, Albany’s most charming upscale bar. A full kitchen comes equipped with all your basic cooking needs, but if you don’t feel like cooking enjoy preferred access and discounts at Dove and Deer.",https://a0.muscache.com/pictures/hosting/Hosting-1237963668912797614/original/416598ea-1389-4245-a732-dc55222f19f2.jpeg,https://www.airbnb.com/users/show/382970529,2021-01-04,"Airbnb has transformed every part of my life for the better. What began as a small side hustle has grown into a cornerstone of my own American Dream. As a high school teacher, I’ve always cherished shaping the future, but hosting on Airbnb allows me to fully embrace and enhance my present. It’s become a creative outlet, enabling me to express my passion for art and design by curating unique, welcoming spaces for my guests. I hope to see you soon!",100%,t,https://a0.muscache.com/im/pictures/user/User-382970529/original/f67e3cf8-d05c-455b-8f4e-7b2a7c4ecad7.jpeg?aki_policy=profile_x_medium,16,"['email', 'phone']",t,SIXTH WARD,42.65507057,Entire rental unit,2,1 bath,1.0,$74.00,30,4,30,30.0,t,4,93,27,0,13,15984.0,24/04/2025,4.93,4.89,4.85,,15,11,3.09
1.24062e+18,20250600000000.0,city scrape,"Newly appointed room beds and. amenities including projector french press teapot etc with easy access in walking distance to the attractions of Albany from this 1800’s mansion district 2  level apt with private entrances and fully stocked full en suite bathroom. Windows open up to a view of the Corning Tower and plaza,  Church of the Immaculate  Conception  and museum.  Stones throw from MVP Arena  and The Capital Centre 4 blocks from Empire Live ! My family (2 kids) and hubby upstairs",https://a0.muscache.com/pictures/hosting/Hosting-1240621479377945523/original/8912eea2-1092-43e7-87fa-2ce68878bd1b.jpeg,https://www.airbnb.com/users/show/412416973,2021-07-12,Hi I’m Susan from San Diego!,83%,f,https://a0.muscache.com/im/pictures/user/User/original/94c4d05a-9b65-4788-9111-b7aa3d43848e.jpeg?aki_policy=profile_x_medium,1,['phone'],f,SECOND WARD,42.64566907,Private room in rental unit,2,1 private bath,3.0,$44.00,1125,1,1125,1125.0,t,44,253,7,0,2,1848.0,28/01/2025,4.57,4.57,4.71,,1,1,0.93
1.24223e+18,20250600000000.0,city scrape,"Enjoy a cozy, well-clean room just a 5-minute walk from fantastic restaurants and downtown shopping. This peaceful space is ideal for anyone. <br /><br />No smoking or alcohol allowed. Must be clean and nice.",https://a0.muscache.com/pictures/hosting/Hosting-1242227342075722524/original/658a2f2c-55c3-476b-9402-7567b92739fa.jpeg,https://www.airbnb.com/users/show/594734396,2024-08-07,,80%,f,https://a0.muscache.com/im/pictures/user/User/original/8b25747d-1a0c-48aa-882e-e90dac9ac961.jpeg?aki_policy=profile_x_medium,2,['phone'],t,SECOND WARD,42.6425,Private room in rental unit,1,1 shared bath,1.0,$73.00,365,1,365,365.0,t,51,301,32,1,13,14016.0,03/06/2025,4.69,4.72,4.34,,2,2,3.76
1.24645e+18,20250600000000.0,city scrape,The whole group will enjoy easy access to everything from this centrally located place.,https://a0.muscache.com/pictures/hosting/Hosting-1246452851774715158/original/9271621a-e23b-48b5-8fad-14a60d9dfcaa.jpeg,https://www.airbnb.com/users/show/652223872,2024-09-15,,100%,f,https://a0.muscache.com/im/pictures/user/User/original/6ffdf3e2-e184-48ed-aff9-e15308d3623b.jpeg?aki_policy=profile_x_medium,1,"['email', 'phone']",t,TENTH WARD,42.65941683,Private room in home,1,1 shared bath,1.0,$52.00,365,3,365,365.0,t,0,297,4,0,4,1248.0,23/12/2024,5.0,5.0,4.75,,1,1,0.5
1.2522e+18,20250600000000.0,city scrape,"Charming first-floor apartment with five cozy bedrooms & 1.5 modern bathrooms. Your private bedroom has a full-size bed, dresser, ample closet space, blackout curtains & Smart TV. Custom stone fireplace in the living room, original hardwood floors, washer & dryer. Fully equipped kitchen w/ quartz countertops & stainless steel appliances, generous-sized dining room table, free street parking, and weekly cleaning of common areas. Prime location with easy access to local food spots and hospitals.",https://a0.muscache.com/pictures/hosting/Hosting-1252203595666312568/original/75541cea-6f26-4641-90ed-17117367f3d0.jpeg,https://www.airbnb.com/users/show/349460842,2020-06-10,Hi my name is Scott Guadagnino. I’ve been in the Albany area for 9 years. Went to school in South Carolina. We love hosting and having guests at our 4 Airbnb’s!,100%,t,https://a0.muscache.com/im/pictures/user/User-349460842/original/b19931f2-cd8b-4aec-96be-ecf0a6a0161d.jpeg?aki_policy=profile_x_medium,17,"['email', 'phone']",t,TENTH WARD,42.66517905,Private room in home,1,1.5 shared baths,1.0,$52.00,365,28,365,365.0,t,21,325,0,0,0,0.0,,,,,,17,13,
1.25226e+18,20250600000000.0,city scrape,"4th floor 1BR walkup in a safe area downtown Albany.Street parking only.There is public transit.Ideal for quiet:1 day visits, bar exam takers, interns, job interviewees, working professionals. Across the street fromNYS Capitol,NYS Education office, Cathedral, SUNY Albany Downtown,Bar ExamState Exams, I787, Route 9,Washington square park, and all fine dining/Lark Street, LGBTQIA+ friendly. Walking distance from Greyhound bus. Seeking friends. I am a parent and student who is at the library often.",https://a0.muscache.com/pictures/miso/Hosting-1252255960109808438/original/dbb588de-7e19-4e9e-ad44-c161b0661b9a.jpeg,https://www.airbnb.com/users/show/172861174,2018-02-11,,80%,f,https://a0.muscache.com/im/pictures/user/ed804f13-00d8-4b09-a658-6b2606c196eb.jpg?aki_policy=profile_x_medium,1,"['email', 'phone']",f,THIRD WARD,42.6551298,Private room in condo,2,1 private bath,1.0,$100.00,365,1,365,365.0,t,47,351,7,1,3,4200.0,10/05/2025,5.0,5.0,4.57,,1,1,0.87
1.25226e+18,20250600000000.0,city scrape,Keep it simple at this peaceful and centrally-located place. Centrally located between St Peter's and Albany Med this home is  3 bed  2 bath home located on a quiet street. The home has central air plenty of parking and is a perfect home away from home ! The home has washer and dryer and heated bathroom floor for the cold months !,https://a0.muscache.com/pictures/hosting/Hosting-1252258297385952172/original/894812af-62d2-4548-b271-1b6b5e054ef9.jpeg,https://www.airbnb.com/users/show/38324986,2015-07-13,,100%,f,https://a0.muscache.com/im/users/38324986/profile_pic/1441410959/original.jpg?aki_policy=profile_x_medium,1,"['email', 'phone']",t,EIGHTH WARD,42.64548739,Entire home,5,2 baths,2.0,$285.00,120,3,1125,1125.0,t,0,289,0,0,0,0.0,,,,,,1,0,
1.2523e+18,20250600000000.0,city scrape,"Charming first-floor apartment with five cozy bedrooms & 1.5 modern bathrooms. Your private bedroom has a full-size bed, dresser, ample closet space, blackout curtains & Smart TV. Custom stone fireplace in the living room, original hardwood floors, washer & dryer. Fully equipped kitchen w/ quartz countertops & stainless steel appliances, generous-sized dining room table, free street parking, and weekly cleaning of common areas. Prime location with easy access to local food spots and hospitals.",https://a0.muscache.com/pictures/miso/Hosting-1158059552251999833/original/7b3e628d-eab2-4de5-ad1c-49658e8fa898.jpeg,https://www.airbnb.com/users/show/349460842,2020-06-10,Hi my name is Scott Guadagnino. I’ve been in the Albany area for 9 years. Went to school in South Carolina. We love hosting and having guests at our 4 Airbnb’s!,100%,t,https://a0.muscache.com/im/pictures/user/User-349460842/original/b19931f2-cd8b-4aec-96be-ecf0a6a0161d.jpeg?aki_policy=profile_x_medium,17,"['email', 'phone']",t,TENTH WARD,42.66555578,Private room in home,1,1.5 shared baths,1.0,$52.00,365,28,365,365.0,t,49,353,1,0,1,2912.0,27/11/2024,5.0,5.0,5.0,,17,13,0.15
1.25639e+18,20250600000000.0,city scrape,"Welcome to our 1Bedroom apartment located in the heart of Albany minutes away from downtown, steps away from Albany Med and across Washington park.",https://a0.muscache.com/pictures/hosting/Hosting-1256391301639690602/original/ec572a8e-b846-4161-92b1-988152b8204f.jpeg,https://www.airbnb.com/users/show/37769478,2015-07-07,Hello just a traveler who loves to enjoy others living space and learn about their culture as I share my space and culture with others. ,98%,,https://a0.muscache.com/im/pictures/user/19024941-bf47-4590-ad50-81973610b5b5.jpg?aki_policy=profile_x_medium,14,"['email', 'phone']",t,SIXTH WARD,42.65422977,Entire rental unit,2,1 bath,1.0,$88.00,1125,1,1125,434.4,t,16,320,10,0,4,5280.0,21/03/2025,4.5,4.8,4.3,,11,0,1.2
1.2565e+18,20250600000000.0,city scrape,"Welcome to the *LEO* home! Recently renovated 1st floor 4 bedroom apartment. With a shared living room, bathroom, and kitchen. It is only 1 mile from Albany Med and nearby local hospitals. This is a shared accommodation with other professionals. One traveler is allowed per bedroom. AC in the bedroom. BRAND NEW full-size memory foam mattress and new pillows! Each bedroom has blackout curtains, perfect for night shifters or swing shifts!",https://a0.muscache.com/pictures/miso/Hosting-902326803627859755/original/3870877c-f0df-4b2c-916b-6068da4b5314.jpeg,https://www.airbnb.com/users/show/349460842,2020-06-10,Hi my name is Scott Guadagnino. I’ve been in the Albany area for 9 years. Went to school in South Carolina. We love hosting and having guests at our 4 Airbnb’s!,100%,t,https://a0.muscache.com/im/pictures/user/User-349460842/original/b19931f2-cd8b-4aec-96be-ecf0a6a0161d.jpeg?aki_policy=profile_x_medium,17,"['email', 'phone']",t,TENTH WARD,42.66226,Private room in home,1,1 shared bath,1.0,$52.00,365,30,365,365.0,t,60,179,0,0,0,0.0,,,,,,17,13,
1.25892e+18,20250600000000.0,city scrape,"Welcome to your home away from home! This cozy, one-bedroom apartment on the first floor of a charming building is perfect for couples or solo travelers. You’re just steps away from the vibrant city life yet tucked into a peaceful retreat.  MONTHLY STAYS WELCOME, ASK ABOUT OUR EXTENDED STAY DISCOUNTS.",https://a0.muscache.com/pictures/prohost-api/Hosting-1258922176307142144/original/347c2579-7e61-496c-8c7b-69fcf899e714.jpeg,https://www.airbnb.com/users/show/18490980,2014-07-20,"Hello!  My name is Jeremy, I'm a host and a realtor.  My wife, Nicole, and I run Drifter Stays, a professional short term rental management company.  We've been hosting guests since 2014 and look forward to hosting you in one of our places very soon!",100%,t,https://a0.muscache.com/im/pictures/user/User/original/b4552081-afb8-45c5-8666-55ecc816128e.jpeg?aki_policy=profile_x_medium,13,"['email', 'phone']",t,SIXTH WARD,42.6544762,Entire home,2,1 bath,1.0,$83.00,90,3,90,90.0,t,60,179,6,0,6,2988.0,30/12/2024,4.33,4.83,4.33,,2,0,0.74
1.2596e+18,20250600000000.0,city scrape,"Welcome to this cozy and convenient studio apartment in Albany, NY — perfect for solo travelers, couples, or professionals on assignment. Located on the first floor of a quiet building, this space offers easy access to downtown, major hospitals, and the serene beauty of Washington Park, just steps away.<br /><br />Whether you're in town for work or an extended visit, you'll appreciate the blend of comfort and location.<br /><br />Monthly stays are welcome — ask about our extended stay discounts!",https://a0.muscache.com/pictures/prohost-api/Hosting-1259604917138801047/original/88cb40fa-26d9-449e-93b3-be2c3d28b7c5.jpeg,https://www.airbnb.com/users/show/18490980,2014-07-20,"Hello!  My name is Jeremy, I'm a host and a realtor.  My wife, Nicole, and I run Drifter Stays, a professional short term rental management company.  We've been hosting guests since 2014 and look forward to hosting you in one of our places very soon!",100%,t,https://a0.muscache.com/im/pictures/user/User/original/b4552081-afb8-45c5-8666-55ecc816128e.jpeg?aki_policy=profile_x_medium,13,"['email', 'phone']",t,SIXTH WARD,42.6551724,Entire home,2,1 bath,1.0,$93.00,120,4,120,120.0,t,55,174,8,1,2,23715.0,17/05/2025,4.5,4.38,4.75,,2,0,1.0
1.26453e+18,20250600000000.0,city scrape,"Located in the heart of Albany, this spacious and rare 2 BR unit offers a bright kitchen and living room - a king size bed in each bedroom. Enjoy the privacy of a separate entrance apart from the building, and easy access to nearby attractions and restaurants.",https://a0.muscache.com/pictures/miso/Hosting-1264531987910224088/original/ebaacdd8-f89d-449d-a95c-bf41d3cff5e4.jpeg,https://www.airbnb.com/users/show/47625981,2015-10-28,,100%,f,https://a0.muscache.com/im/pictures/user/fcdee17f-16de-4999-98d5-c28b545cc982.jpg?aki_policy=profile_x_medium,19,"['email', 'phone']",t,SEVENTH WARD,42.64762857,Entire rental unit,5,1 bath,2.0,$131.00,365,1,365,365.0,t,41,335,25,2,8,19650.0,18/05/2025,4.8,4.88,4.6,,18,0,3.13
