id,scrape_id,source,description,picture_url,host_url,host_since,host_about,host_response_rate,host_is_superhost,host_picture_url,host_listings_count,host_verifications,host_identity_verified,neighbourhood_cleansed,latitude,property_type,accommodates,bathrooms_text,beds,price,maximum_nights,maximum_minimum_nights,maximum_maximum_nights,maximum_nights_avg_ntm,has_availability,availability_60,availability_365,number_of_reviews,number_of_reviews_l30d,number_of_reviews_ly,estimated_revenue_l365d,last_review,review_scores_accuracy,review_scores_checkin,review_scores_location,license,calculated_host_listings_count,calculated_host_listings_count_private_rooms,reviews_per_month
2992450.0,20250600000000.0,city scrape,"The apartment is located in a quiet neighborhood . Fully furnished. Linens and towels are provided. It's two blocks away from downtown Albany, and the Palace theater.",https://a0.muscache.com/pictures/44627226/0e72c75c_original.jpg,https://www.airbnb.com/users/show/4621559,2013-01-07,I am a real down to earth & cool person.,100%,f,https://a0.muscache.com/im/users/4621559/profile_pic/1363081467/original.jpg?aki_policy=profile_x_medium,1,"['email', 'phone']",t,THIRD WARD,42.65789,Entire rental unit,4,1 bath,2.0,$70.00,1125,28,1125,1125.0,t,0,70,9,0,0,0.0,17/08/2022,3.44,4.22,3.22,,1,0,0.07
3820211.0,20250600000000.0,city scrape,"Cozy, cool little 1BR Apt in the heart Albany's Center Sq. close to everything.  Enjoy the hip, walking neighborhood and verdant Washington Park in a neighborhood with great eats, architecture and culture... Everything you need down to the corkscrew.",https://a0.muscache.com/pictures/prohost-api/Hosting-3820211/original/7a087429-5f8f-4c7f-990a-291a82b784dc.jpeg,https://www.airbnb.com/users/show/19648678,2014-08-07,"I'm from Kansas City, MO. I've driven the entire US, logging over a  million miles on a 10 year working road trip. I settled in Albany, NY, a hardworking, no-nonsense sort of town, drenched in history, education and politics. I love this town not just for the town itself as much as the location. It's truly a sportsman's(sportswoman's) paradise, while being so close to very civilized civilization. There's easy access to NYC, Saratoga, Lake George, Vermont, Montreal & my favorite The Berkshires in Massachusetts.  ",100%,t,https://a0.muscache.com/im/users/19648678/profile_pic/1407449767/original.jpg?aki_policy=profile_x_medium,4,"['email', 'phone']",t,SIXTH WARD,42.65222,Entire rental unit,2,1 bath,1.0,$100.00,1125,3,1125,1125.0,t,30,335,308,0,15,3600.0,29/03/2025,4.89,4.85,4.83,,4,0,2.34
5651579.0,20250600000000.0,city scrape,"Spacious studio with hardwood floors, fully equipped kitchen, clean and bright. Large modern bath .  Full Cable TV and WiFi. Walking distance to the new Renaissance Hotel.<br />Walk to everything downtown! The Empire Plaza  and the Egg are  across the street.You can't get any closer, to the MVP Arena,  as well as Restaurants, bars, churches. Walk to  Capital and the new Capital Convention Center. Laundry facilities in the apartment",https://a0.muscache.com/pictures/b3fc42f3-6e5e-4704-9d0f-8ceee5d32046.jpg,https://www.airbnb.com/users/show/29288920,2015-03-13,I am an Albany native .I have lived in Ireland and had a B & B in Tramore County Waterford back in the early nineties. While doing so we met a lot of wonderful people. I have been in the real estate business for over 30 years . I believe in keeping the mind and body fit. I am easy going and love a good laugh. ,100%,t,https://a0.muscache.com/im/users/29288920/profile_pic/1426286865/original.jpg?aki_policy=profile_x_medium,2,"['email', 'phone', 'work_email']",t,SECOND WARD,42.64615,Entire rental unit,2,1 bath,1.0,$75.00,45,2,1125,1125.0,t,0,15,371,0,38,10800.0,16/02/2025,4.62,4.81,4.76,,2,1,3.02
6623339.0,20250600000000.0,city scrape,"Large renovated 1 bedroom apartment in converted police precinct with original tin ceilings. Center Square-the ""village in the city."" Located in a restored police precinct, you are within walking distance of everything, including verdant Washington Park, restaurants and pubs of Lark St., the state capitol, downtown, Albany Med/Law/Pharmacy.",https://a0.muscache.com/pictures/prohost-api/Hosting-6623339/original/fe9b077d-2c75-458d-a4c1-71fed46d598a.jpeg,https://www.airbnb.com/users/show/19648678,2014-08-07,"I'm from Kansas City, MO. I've driven the entire US, logging over a  million miles on a 10 year working road trip. I settled in Albany, NY, a hardworking, no-nonsense sort of town, drenched in history, education and politics. I love this town not just for the town itself as much as the location. It's truly a sportsman's(sportswoman's) paradise, while being so close to very civilized civilization. There's easy access to NYC, Saratoga, Lake George, Vermont, Montreal & my favorite The Berkshires in Massachusetts.  ",100%,t,https://a0.muscache.com/im/users/19648678/profile_pic/1407449767/original.jpg?aki_policy=profile_x_medium,4,"['email', 'phone']",t,SIXTH WARD,42.65222,Entire rental unit,2,1 bath,1.0,$95.00,1125,3,1125,1125.0,t,0,282,331,0,22,7980.0,09/02/2025,4.83,4.82,4.8,,4,0,2.72
9005989.0,20250600000000.0,city scrape,"(21 years of age or older ONLY) NON- SMOKING.. NO PARTIES Allowed.  Cozy basement apartment in a historic brownstone in the heart of ""Center Square"".  Surrounded by shops, restaurants, and night life. Walking distance to Albany Med, State Offices, The State Capital, and The Empire State Plaza. 30 mins from Saratoga Raceway. 50 mins from Lake George. 1/2 mile Palace theater",https://a0.muscache.com/pictures/d242a77e-437c-4d0a-9029-005a05f8d282.jpg,https://www.airbnb.com/users/show/17766924,2014-07-07,,100%,t,https://a0.muscache.com/im/pictures/user/ae311d04-cbca-423a-aa92-8a4b3d6997de.jpg?aki_policy=profile_x_medium,1,"['email', 'phone']",t,SIXTH WARD,42.65559,Entire rental unit,4,1 bath,2.0,$86.00,1125,1,1125,1125.0,t,0,128,620,0,31,14964.0,08/05/2025,4.86,4.95,4.87,,1,0,5.76
9501054.0,20250600000000.0,city scrape,"Great location within walking distance to the Capital. It is a good size bedroom with WiFi internet . Private full bath.  We provide in the room a small refrigerator, Microwave ,coffee pot,iron ,hair dryer and  TV. Lots of entertainment nearby. Brew pubs, restaurants, the NYS Museum. Governor's Mansion. Washington Park.Capital Rep Theater as well as the Palace Theater.",https://a0.muscache.com/pictures/45153167-d704-48ed-9320-ab2f139bd352.jpg,https://www.airbnb.com/users/show/29288920,2015-03-13,I am an Albany native .I have lived in Ireland and had a B & B in Tramore County Waterford back in the early nineties. While doing so we met a lot of wonderful people. I have been in the real estate business for over 30 years . I believe in keeping the mind and body fit. I am easy going and love a good laugh. ,100%,t,https://a0.muscache.com/im/users/29288920/profile_pic/1426286865/original.jpg?aki_policy=profile_x_medium,2,"['email', 'phone', 'work_email']",t,SECOND WARD,42.64734,Private room in rental unit,2,1 private bath,2.0,$52.00,60,1,60,60.0,t,34,223,418,2,42,10608.0,31/05/2025,4.72,4.84,4.77,,2,1,3.67
10768745.0,20250600000000.0,city scrape,Spacious warm studio in 1840 house close to hospitals and downtown. Own bath flat screen cable tv wireless internet ground floor. Double bed coffee tea fridge microwave and parking. Suit 1. On park walk to post office cvs Chinese sports bar. Comfortable and decorated with taste. Irish host,https://a0.muscache.com/pictures/hosting/Hosting-10768745/original/20b04600-3c69-432b-9a22-f10701cdb82d.jpeg,https://www.airbnb.com/users/show/5691268,2013-03-30,I'm Irish living in Albany NY.  I have 3 grown up kids.  I have 2 chihuauas    I am visiting Toronto to meet my sister and nephew who are visiting from Ireland.  Don't smoke or drink just love my dogs!,95%,t,https://a0.muscache.com/im/pictures/user/d34e69f3-8c6e-48e7-b3f5-c2d42939675a.jpg?aki_policy=profile_x_medium,2,"['email', 'phone']",f,FOURTEENTH WARD,42.66078,Private room in guest suite,1,1 private bath,1.0,$54.00,1125,1,1125,1125.0,t,36,153,792,4,128,13770.0,21/05/2025,4.89,4.93,4.92,,2,2,6.96
11253948.0,20250600000000.0,city scrape,"Cute single family bungalow (1200sqft) in a convenient location with the lots of restaurants, bars and shops right around the corner. <br /><br />Totally renovated with open floor plan.<br /><br />77” 2023 LG B3 OLED TV  just added to living room with Sonos surround + sub!<br /><br />3 Bedrooms with 1 King bed, 2 Queen beds, 1 Full sized bed and 2 airbeds can be added upon request.  Easy Parking two lane driveway by house.<br /><br />$50 pet fee, please inquire before booking, thank you!",https://a0.muscache.com/pictures/f0e43651-0834-4cbd-9d7d-72ef465a316d.jpg,https://www.airbnb.com/users/show/4259750,2012-11-27,"I was born in Poland but grew up in NY and now i'm back in NY after grad school in Europe.  I love sailing, flying gliders, hiking, hammocks, cycling, photography, travel, minimalism, tennis,  podcasts, biohacking and my KJV.  I started traveling airbnb during my time in Europe and now I’m a host in NY! 
Listings:
airbnb.com/h/38eden
airbnb.com/h/55eden
airbnb.com/h/18home
airbnb.com/h/24miller
airbnb.com/h/24eden
airbnb.com/h/433western",100%,t,https://a0.muscache.com/im/pictures/user/cca29440-809e-4dcd-a844-221898102fa5.jpg?aki_policy=profile_x_medium,8,"['email', 'phone']",t,FIFTEENTH WARD,42.67567,Entire place,10,2 baths,4.0,$264.00,1124,2,1124,1124.0,t,37,326,188,2,34,47520.0,18/05/2025,4.93,4.99,4.95,,8,0,1.71
11639446.0,20250600000000.0,city scrape,"Regular breakfast free<br /><br />Lunch packed $5<br />Dinner Plate $10<br /><br />We updated cleaning protocol because of COVID-19 pandemic<br /><br />OUR PRIORITY IS ORGANIC LIFE SO OTHER THING IS LESS IMPORTANT <br />FREE LAUNDRY <br />AIR CONDITIONING <br />No parking space on premises just street parking<br />.<br />Internet High speed WiFi,<br />This building is 100 years older.<br />We don't use chemical pesticides ,chemical cleaning stuff.We use Vinegar,baking powder,biological pesticides .<br />Therefore not fancy clea",https://a0.muscache.com/pictures/1129f67c-dfb2-4a2c-bb1d-914a3245d600.jpg,https://www.airbnb.com/users/show/61700428,2016-03-05,"Guest's satisfaction and happiness is much more important than money!
顾客的满意远比赚钱重要!我的初衷是帮助更多的人､服务更多的人~
We provide emotional comfort more than physically comfortable
我们提供的情感舒适度超过身体舒适度.",,f,https://a0.muscache.com/im/pictures/user/fcc2b09f-611c-457c-828b-43336a05dfae.jpg?aki_policy=profile_x_medium,2,"['email', 'phone']",t,ELEVENTH WARD,42.67583,Private room in home,1,1.5 shared baths,1.0,$55.00,112,15,112,112.0,t,60,365,231,0,2,0.0,29/02/2024,4.87,4.94,4.52,,2,2,2.1
12799126.0,20250600000000.0,city scrape,,https://a0.muscache.com/pictures/3e656127-d8e2-4743-a405-1b91d81c4dc7.jpg,https://www.airbnb.com/users/show/69729286,2016-05-01,,100%,f,https://a0.muscache.com/im/pictures/user/5507d01f-fe58-4066-9900-5de519b5dfd6.jpg?aki_policy=profile_x_medium,2,"['email', 'phone']",t,SIXTH WARD,42.65154,Private room in rental unit,1,1 shared bath,1.0,$47.00,1125,5,1125,1125.0,t,41,344,28,0,1,0.0,06/02/2024,4.89,4.82,4.71,,2,2,0.48
13083497.0,20250600000000.0,city scrape,"Immaculate two level 3000 Sq. Ft. Bright & Sunny Cape Cod with 4 large bedrooms, Den, 2 full baths, living, dining & kitchen. Central Air & Heat. The house is situated in upscale Pine hills neighborhood on a quite dead end street with a Creek flowing through the back of the property. Peaceful & Serene View from Deck. Convenient location. Parking, Streaming Channels & WiFi included.  Relax on the deck overlooking creek with nature sounds. Short drive  to Ski Resorts.",https://a0.muscache.com/pictures/a430d734-d978-4b2e-bcc9-876618efc4ac.jpg,https://www.airbnb.com/users/show/1364123,2011-11-02,"Nature loving person with a major focus on health, cleanliness and education. I am from India,  but lived in NY since 2001. I have a passion for sports and love traveling and exploring new parts of the US. I enjoy long walks, jogging, hiking, yoga and meditation. My goal for Airbnb guests is to offer the very best stay experience via ""Immaculately Clean - Home Away From Home""  at a reasonable price.",100%,f,https://a0.muscache.com/im/pictures/user/32770a54-86fc-4904-9d34-74fc47588167.jpg?aki_policy=profile_x_medium,1,"['email', 'phone']",t,FIFTEENTH WARD,42.66972,Entire home,8,2 baths,4.0,$219.00,1125,2,1125,1125.0,t,23,306,189,1,15,15768.0,10/05/2025,4.8,4.89,4.8,,1,0,1.74
14989805.0,20250600000000.0,city scrape,"My place is close to University of Albany, shopping malls and plazas, bars, restaurants, the airport, the city center, parks, art and culture. You’ll love my place because of the location, the ambiance, the outdoors space, fully renovated, newly furnished, nice yard, awesome double rear deck,  open floor plan and central air.   My place is good for couples, solo adventurers, business travelers, families (with kids), big groups, and furry friends ($50 pet fee w/ booties included).",https://a0.muscache.com/pictures/408eb58e-caa7-4021-9a9e-dfa49e849052.jpg,https://www.airbnb.com/users/show/4259750,2012-11-27,"I was born in Poland but grew up in NY and now i'm back in NY after grad school in Europe.  I love sailing, flying gliders, hiking, hammocks, cycling, photography, travel, minimalism, tennis,  podcasts, biohacking and my KJV.  I started traveling airbnb during my time in Europe and now I’m a host in NY! 
Listings:
airbnb.com/h/38eden
airbnb.com/h/55eden
airbnb.com/h/18home
airbnb.com/h/24miller
airbnb.com/h/24eden
airbnb.com/h/433western",100%,t,https://a0.muscache.com/im/pictures/user/cca29440-809e-4dcd-a844-221898102fa5.jpg?aki_policy=profile_x_medium,8,"['email', 'phone']",t,FIFTEENTH WARD,42.673512,Entire home,7,2 baths,2.0,$260.00,730,1,730,730.0,t,10,315,113,0,26,31200.0,06/04/2025,4.96,4.98,4.85,,8,0,1.08
15580397.0,20250600000000.0,city scrape,"Private bedroom, shared living room, and shared bathroom on the 2nd floor in my personal home with 2-3 guests.   3 fans in each bedroom. Mini fridge, microwave, coffee maker, and toaster in the room.  No ac and no kitchen use. Self-check-in Owner-occupied house. On bus lines. You’ll love my place because of its uniqueness, location, and vintage finds.  Direct bus line to Greyhound, Amtrak, Mall, Empire State Plaza, , and Suny Albany.  Free street parking only.",https://a0.muscache.com/pictures/hosting/Hosting-15580397/original/a4ce141f-5a16-4ccc-9bc4-83cb26fe4cba.jpeg,https://www.airbnb.com/users/show/89705052,2016-08-13,"We are fully vaccinated for Covid-19 with boosters. (Mother and daughter) Please note: Bad reviews are from guests breaking my house rules, not reading the listing description about my room spaces and amenities offered. Also, from racists, haters and misogynistic guests.
We are well traveled African American women and we take pride in our culture and ancestors. It is important to be our authentic selves, without being washed.  My home has ethnic food smells, flags, sarcastic signs, Black art, social justice signs and visiable security cameras. Yes! 5 out of eight letters of my name spell SHARE :) I was a home school/unschooled parent. (Florida and Nevada) My daughter graduated from University At Albany with honors. Class of 2020... and recently graduated with a master's degree.  Class of 2021. She is currently a PhD student at Stony Brook University.  We are hosts and guests of Airbnb. I am originally from Chicago and The Bronx. I am a non smoker and non drinker. We traveled to many states on a budget, including Alaska and Hawaii. We also traveled to: Canada, Mexico, Caribbean and Europe.  We loved Victoria, BC, Montreal, QC, Dublin, Ireland, Paris, France and Brussels, Belgium the most.  I love older homes with character and history. I am a proud owner of a ""Turn Of A Century""  Classic American Foursquare. unique home. (1900)  Captain Arthur William Brandt was one of the previous owners. I had bought my house. in 1999.  We are passionate about social justice issues. We lived in Miami, Orlando/Winter Park, Las Vegas, Montreal and Dominican Republic. I enjoy watching home improvement shows and documentaries. I love to shop at thrift stores for rare, cultured and vintage finds. We love the beauty and peacefulness of nature. We love musicals and ballets. If your last name is (military) Brandt, (pharmacy) Schneible or (nursing)Wagenbaugh, (previous owners) I will offer you 25% off your daily rate. (Not by marriage) Check your Ancestry, Myheritage and 23andme accounts, we maybe related. ;)  I am 9% England/Wales, 3% South Asian  1% Irish, 3% Norway,  1% Native American, 1% Iberian Peninsula and you can guess the rest...lol...(African)  Maternal Melungeon ancestry.  We share paternal DNA with Ramesses lll...Egyptian royalty and my maternal 2nd great grandfather is Little Wyatt Tate and my maternal 4th great grandfather is Judge/senator Charles Tait of Georgia and Alabama... My daughter is 27% European. Caribbean roots . (Jamaica) (DNA)  *Take the test.",100%,f,https://a0.muscache.com/im/pictures/user/User/original/4b6d72d6-2040-4bef-a1ea-43c65dfcbfef.jpeg?aki_policy=profile_x_medium,2,"['email', 'phone']",t,NINTH WARD,42.65651,Private room in home,2,1 shared bath,1.0,$52.00,29,7,1125,1125.0,t,60,115,48,0,8,2496.0,27/02/2025,4.83,4.88,4.81,,2,2,0.49
16531782.0,20250600000000.0,city scrape,Old style comfort.  Large high ceiling studio w kitchen facilities and private walk in shower    Queen size bed.  Lots of windows.  Ceiling fan. Window a/c.   Old world ambience with large mirrors and wallpaper.  Street level.  No stairs.  Parking at the door in driveway.  Porch w rocking chairs. Lots of garden. Park  called Greenway across the street.  Walk to post office hospital lots of eateries Starbucks.  15minute bus service from new Scotland ave to downtown.  Wi-Fi 5 G. Lockbox entry.,https://a0.muscache.com/pictures/hosting/Hosting-16531782/original/8c5040d4-591a-4741-a9fe-79d2725a855c.jpeg,https://www.airbnb.com/users/show/5691268,2013-03-30,I'm Irish living in Albany NY.  I have 3 grown up kids.  I have 2 chihuauas    I am visiting Toronto to meet my sister and nephew who are visiting from Ireland.  Don't smoke or drink just love my dogs!,95%,t,https://a0.muscache.com/im/pictures/user/d34e69f3-8c6e-48e7-b3f5-c2d42939675a.jpg?aki_policy=profile_x_medium,2,"['email', 'phone']",f,FOURTEENTH WARD,42.66075,Private room in guest suite,2,1 private bath,1.0,$60.00,1125,1,1125,1125.0,t,37,316,489,5,139,15300.0,25/05/2025,4.85,4.86,4.91,,2,2,7.98
17238066.0,20250600000000.0,city scrape,"IF YOUR PRIORITY IS GOOD NEIGHBORHOOD AND FANCY CLEAN HOUSE”DO NOT PRFER US”<br />IF YOUR PRIORITY IS “””SAFETY PLACE,GREEN LIFE AND ORGANIC NUTRITION””” YOU PREFER US<br />Important notice<br />We updated our cleaning protocol duo to COVID-19 pandemic.<br /><br />This room is not 5 stars hotel room.<br /> Before booking,read carefully about room description.<br />Breakfast free,Wi Fi high speed internet<br />We don't use chemical cleaning stuff.We use Vinegar,baking powder,biological pesticides .",https://a0.muscache.com/pictures/4c939df7-1935-4423-89c8-b32f10ec48ed.jpg,https://www.airbnb.com/users/show/61700428,2016-03-05,"Guest's satisfaction and happiness is much more important than money!
顾客的满意远比赚钱重要!我的初衷是帮助更多的人､服务更多的人~
We provide emotional comfort more than physically comfortable
我们提供的情感舒适度超过身体舒适度.",,f,https://a0.muscache.com/im/pictures/user/fcc2b09f-611c-457c-828b-43336a05dfae.jpg?aki_policy=profile_x_medium,2,"['email', 'phone']",t,FIFTH WARD,42.67614,Private room in home,1,1.5 shared baths,1.0,$53.00,112,15,112,112.0,t,60,365,132,0,2,1590.0,01/08/2024,4.91,4.96,4.67,,2,2,1.33
18341426.0,20250600000000.0,city scrape,"Cute single family home in a convenient location with the lots of restaurants, bars and shops right around the corner. <br /><br /> It features  a driveway with covered parking, a nice outdoor area with seating, lounging and a weber 3 burner propane grill.   The home has central air and a 5 person Clearlight Premier IS-5 infrared cedar sauna by Jacuzzi. <br /><br />My place is close to University of Albany, tennis, shopping malls and plazas, bars, restaurants, the airport, the city center, parks, art and culture.",https://a0.muscache.com/pictures/95aa6d3d-5611-4c75-989e-774206f18c57.jpg,https://www.airbnb.com/users/show/4259750,2012-11-27,"I was born in Poland but grew up in NY and now i'm back in NY after grad school in Europe.  I love sailing, flying gliders, hiking, hammocks, cycling, photography, travel, minimalism, tennis,  podcasts, biohacking and my KJV.  I started traveling airbnb during my time in Europe and now I’m a host in NY! 
Listings:
airbnb.com/h/38eden
airbnb.com/h/55eden
airbnb.com/h/18home
airbnb.com/h/24miller
airbnb.com/h/24eden
airbnb.com/h/433western",100%,t,https://a0.muscache.com/im/pictures/user/cca29440-809e-4dcd-a844-221898102fa5.jpg?aki_policy=profile_x_medium,8,"['email', 'phone']",t,FIFTEENTH WARD,42.67637,Entire home,6,1 bath,3.0,$376.00,1125,3,1125,1125.0,t,60,365,58,0,1,2256.0,13/08/2024,4.93,4.98,4.97,,8,0,0.66
19527043.0,20250600000000.0,city scrape,"Urban Oasis!  2nd Floor master bedroom in residential home.  Queen sized bed. Private bath. Mini-refrigerator, microwave and sitting area in room. Shared entrance but access to full kitchen, bath, bedroom, laundry and parking. Walking distance to Albany Med, Albany Pharmacy, Albany Law School, College of St. Rose and Sage College.  On Main bus line.  10 minute drive from downtown",https://a0.muscache.com/pictures/2861bf31-7118-4e73-8b01-7322844191c3.jpg,https://www.airbnb.com/users/show/15223767,2014-05-07,,90%,t,https://a0.muscache.com/im/pictures/user/87babb57-4dfb-4efd-a995-c781347c9d04.jpg?aki_policy=profile_x_medium,3,"['email', 'phone', 'work_email']",f,NINTH WARD,42.65312,Private room in home,2,1 private bath,1.0,$70.00,1125,2,1125,1125.0,t,45,254,82,0,11,4620.0,17/09/2024,4.96,4.98,4.95,,3,3,1.01
19822913.0,20250600000000.0,city scrape,Relax with the whole family at this peaceful place to stay.Very comfortable cozy and cool also Pet friendly.,https://a0.muscache.com/pictures/miso/Hosting-19822913/original/f7b2a16a-bd92-4941-8e6a-fc3c84177667.jpeg,https://www.airbnb.com/users/show/140060931,2017-07-12,,100%,f,https://a0.muscache.com/defaults/user_pic-225x225.png?v=3,1,['phone'],f,FOURTH WARD,42.6688429,Entire home,5,1.5 baths,3.0,$214.00,29,1,29,29.0,t,59,88,0,0,0,0.0,,,,,,1,0,
20519885.0,20250600000000.0,city scrape,"Our spacious 2048 sq. ft. 5 bedroom. 2 bath, house is the perfect place for serious minded groups. <br /><br />We welcome business travelers and family travelers looking for a quiet, sanitized gorgeous home for extended stays in the city. Our reviews emphasize that we offer the comfortable accommodations to meet all of your needed expectations.<br />Welcome to Albany",https://a0.muscache.com/pictures/efcc69ea-7277-4b8d-bebc-3b0f2500e1c2.jpg,https://www.airbnb.com/users/show/67171774,2016-04-14,"Michael and I are foodies. We love cooking and sharing what we cook with our family and friends. 
We love dancing and music, but most importantly we love a peaceful home.
In my travels, especially business travel, I appreciated most my accommodations where it was clean, where I can feel as though I am home and the host took careful care to my need for peace and privacy. 
In our properties we love to give people the space to feel their privacy is considered, and enough interaction to make them feel as though they are home. We are Inn owners, therefore hosting is something we enjoy. 
Between Michael and I we have 5 sons. From ages 18 thru 33. All with the spirit of service.",100%,t,https://a0.muscache.com/im/pictures/user/30c41259-7716-4a81-9764-b31e8c03738e.jpg?aki_policy=profile_x_medium,1,"['email', 'phone']",t,FOURTEENTH WARD,42.65846,Entire home,9,2 baths,6.0,$290.00,730,4,730,730.0,t,33,331,115,4,16,41760.0,03/06/2025,4.96,4.98,4.89,,1,0,1.25
20620135.0,20250600000000.0,city scrape,"Cute single family home in a convenient location with the lots of restaurants, bars and shops right around the corner. It features a driveway with covered parking, a nice outdoor area and central air. My place is close to University of Albany, shopping malls and plazas, bars, restaurants, the airport, the city center, parks, art and culture. Parties and events are not allowed.",https://a0.muscache.com/pictures/hosting/Hosting-20620135/original/37da42ee-8c0e-4720-ac0c-5e9a17a5c65e.jpeg,https://www.airbnb.com/users/show/4259750,2012-11-27,"I was born in Poland but grew up in NY and now i'm back in NY after grad school in Europe.  I love sailing, flying gliders, hiking, hammocks, cycling, photography, travel, minimalism, tennis,  podcasts, biohacking and my KJV.  I started traveling airbnb during my time in Europe and now I’m a host in NY! 
Listings:
airbnb.com/h/38eden
airbnb.com/h/55eden
airbnb.com/h/18home
airbnb.com/h/24miller
airbnb.com/h/24eden
airbnb.com/h/433western",100%,t,https://a0.muscache.com/im/pictures/user/cca29440-809e-4dcd-a844-221898102fa5.jpg?aki_policy=profile_x_medium,8,"['email', 'phone']",t,FIFTEENTH WARD,42.675,Entire home,6,1 bath,3.0,$196.00,1125,2,1125,1125.0,t,49,354,77,0,8,25872.0,06/05/2025,4.94,4.94,4.84,,8,0,0.83
